{
  "audit_metadata": {
    "audit_id": "dentist-monsoon-dental-audit-001",
    "created_at": "2026-08-11T18:50:00.000Z",
    "updated_at": "2026-08-19T18:43:44.532Z",
    "orchestrator_version": "1.0.0",
    "overall_status": "COMPLETED",
    "current_stage": "pdf_generator"
  },
  "business_context": {
    "business_name": "Monsoon Dental",
    "address": "2195 W Magee Rd, Suite 120",
    "city": "Tucson",
    "state": "AZ",
    "zip": "85742",
    "country": "US",
    "phone": "(520) 441-2505",
    "website": "https://monsoondental.com/",
    "primary_category": "Dentist",
    "secondary_categories": [
      "Cosmetic dentist",
      "Dental clinic",
      "Emergency dental service"
    ],
    "services": [
      "Preventive Dentistry",
      "Restorative Dentistry",
      "Cosmetic Dentistry",
      "Dental Implants",
      "Emergency Dental Care",
      "TMJ / TMD Treatment",
      "Crowns & Bridges",
      "Teeth Whitening"
    ],
    "business_description": "Comprehensive family and cosmetic dental practice in Northwest Tucson (Magee Rd) led by Dr. Bradley Konecnik, DDS, providing preventive, restorative, cosmetic, implant, and emergency dentistry.",
    "google_business_profile_url": "https://maps.app.goo.gl/7on5BA6Zj6R5YRzM6",
    "target_location": "Tucson, Arizona",
    "metadata": {
      "source": "Google Maps Live Profile (https://maps.app.goo.gl/7on5BA6Zj6R5YRzM6)",
      "rating": 5,
      "reviews_count": 21,
      "lead_dentist": "Dr. Bradley Konecnik, DDS",
      "office_hours": "Mon-Thu 8:00 AM - 4:30 PM, Fri-Sun Closed"
    }
  },
  "stages": {
    "business_context": {
      "status": "completed",
      "started_at": "2026-08-11T18:50:00.001Z",
      "completed_at": "2026-08-11T18:50:00.001Z",
      "output_summary": "Canonical context created for Monsoon Dental (Tucson, Arizona)"
    },
    "citation_research": {
      "status": "completed",
      "started_at": "2026-08-11T18:50:00.002Z",
      "completed_at": "2026-08-11T18:50:00.002Z",
      "output_summary": "14 directories evaluated; healthcare-specific directory gaps identified"
    },
    "citation_analysis": {
      "status": "completed",
      "started_at": "2026-08-11T18:50:00.003Z",
      "completed_at": "2026-08-11T18:50:00.003Z",
      "output_summary": "1 healthcare directory claiming finding formulated"
    },
    "gbp_audit": {
      "status": "completed",
      "started_at": "2026-08-11T18:50:00.004Z",
      "completed_at": "2026-08-11T18:50:00.004Z",
      "output_summary": "Verified profile (5.0 ★, 21 reviews); specialized dental catalog expansion opportunity"
    },
    "review_analysis": {
      "status": "completed",
      "started_at": "2026-08-11T18:50:00.005Z",
      "completed_at": "2026-08-11T18:50:00.005Z",
      "output_summary": "21 reviews with flawless 5.0 ★ rating; review velocity opportunity"
    },
    "competitor_analysis": {
      "status": "completed",
      "started_at": "2026-08-11T18:50:00.006Z",
      "completed_at": "2026-08-11T18:50:00.006Z",
      "output_summary": "1 relevant Northwest Tucson competitor benchmarked (Gentle Dental: 520 reviews, 4.8 ★)"
    },
    "website_gate": {
      "status": "completed",
      "started_at": "2026-08-11T18:50:00.007Z",
      "completed_at": "2026-08-11T18:50:00.007Z",
      "output_summary": "Recommended (active site with missing Dentist schema)"
    },
    "website_audit": {
      "status": "completed",
      "started_at": "2026-08-11T18:50:00.008Z",
      "completed_at": "2026-08-11T18:50:00.008Z",
      "output_summary": "Missing Dentist / LocalBusiness schema markup; fast mobile experience"
    },
    "evidence_validation": {
      "status": "completed",
      "started_at": "2026-08-11T18:50:00.009Z",
      "completed_at": "2026-08-11T18:50:00.009Z",
      "output_summary": "5 findings validated for quality and claim safety"
    },
    "priority_engine": {
      "status": "completed",
      "started_at": "2026-08-11T18:50:00.010Z",
      "completed_at": "2026-08-11T18:50:00.010Z",
      "output_summary": "4 strategic priorities scored and ranked (Top 5 cap enforced)"
    },
    "report_writer": {
      "status": "completed",
      "started_at": "2026-08-11T18:50:00.011Z",
      "completed_at": "2026-08-11T18:50:00.011Z",
      "output_summary": "Client narrative structured into report_content.json"
    },
    "report_designer": {
      "status": "completed",
      "started_at": "2026-08-11T18:50:00.012Z",
      "completed_at": "2026-08-11T18:50:00.012Z",
      "output_summary": "Visual layout specification compiled into report_design.json"
    },
    "pdf_generator": {
      "status": "completed",
      "started_at": "2026-08-11T18:50:00.013Z",
      "completed_at": "2026-08-11T18:52:00.000Z",
      "output_summary": "PDF rendered (8 pages, 1360.9 KB)"
    }
  },
  "evidence_registry": {
    "cit-001": {
      "evidence_id": "cit-001",
      "source_stage": "citation_research",
      "evidence_type": "citation_listing",
      "fact": "Yelp listing is verified with accurate NAP, but healthcare-specific directories (Healthgrades, Zocdoc, WebMD Care, DentalPlans) are unclaimed or lack complete practice profiles.",
      "source_url": "https://www.healthgrades.com"
    },
    "gbp-001": {
      "evidence_id": "gbp-001",
      "source_stage": "gbp_audit",
      "evidence_type": "gbp_profile",
      "fact": "Google Business Profile is claimed and verified with 5.0 ★ rating across 21 reviews, but lacks structured service descriptions for specialized procedures like TMJ/TMD therapy and Dental Implants.",
      "source_url": "https://maps.app.goo.gl/7on5BA6Zj6R5YRzM6"
    },
    "rev-001": {
      "evidence_id": "rev-001",
      "source_stage": "review_analysis",
      "evidence_type": "review_sentiment",
      "fact": "21 Google reviews with a flawless 5.0 average rating; unanimous patient satisfaction praising Dr. Konecnik and team for gentle, no-pressure care; low overall volume creates a competitive gap.",
      "source_url": "https://maps.app.goo.gl/7on5BA6Zj6R5YRzM6"
    },
    "comp-001": {
      "evidence_id": "comp-001",
      "source_stage": "competitor_analysis",
      "evidence_type": "competitor_benchmark",
      "fact": "Gentle Dental (Oracle Rd) in Northwest Tucson maintains 520+ Google reviews (4.8 ★) and 15 listed dental service categories.",
      "source_url": "https://maps.google.com"
    },
    "web-001": {
      "evidence_id": "web-001",
      "source_stage": "website_audit",
      "evidence_type": "json_ld_schema",
      "fact": "Homepage has no JSON-LD Dentist or LocalBusiness structured schema markup with physical address, geo-coordinates, telephone, or opening hours.",
      "source_url": "https://monsoondental.com/"
    }
  },
  "outputs": {
    "report_content": {
      "metadata": {
        "report_id": "dentist-monsoon-dental-audit-001",
        "business_name": "Monsoon Dental",
        "business_location": "Tucson, Arizona",
        "audit_date": "2026-08-11",
        "generated_at": "2026-08-11T18:50:00.000Z",
        "rating": 5,
        "reviews_count": 21,
        "services_count": 8
      },
      "cover": {
        "report_title": "Local Visibility Audit",
        "business_name": "Monsoon Dental",
        "location": "Tucson, Arizona",
        "subtitle": "Prepared from a verified multi-channel local visibility diagnostic"
      },
      "executive_snapshot": {
        "foundation_summary": "Monsoon Dental demonstrates an exceptional reputation foundation with a verified Google Business Profile and a flawless 5.0-star rating across 21 reviews in Northwest Tucson.",
        "key_observation": "Unclaimed healthcare directory profiles, specialized GBP service descriptions, and competitor review volume represent the most immediate visibility growth opportunities.",
        "priority_areas": [
          "Claim Healthcare-Specific Directory Profiles",
          "Accelerate Patient Review Acquisition Process",
          "Expand Google Business Profile Dental Service Descriptions",
          "Implement Dentist JSON-LD Structured Schema Markup"
        ]
      },
      "business_foundation": {
        "intro": "The following areas represent verified strengths identified during the audit.",
        "strengths": [
          {
            "area": "Customer Sentiment & Trust",
            "observation": "Your flawless 5.0-star rating across 21 reviews highlights exceptional patient satisfaction and gentle clinical care."
          },
          {
            "area": "Google Business Profile Foundation",
            "observation": "Your profile is claimed, verified, and established in the Northwest Tucson (Magee Rd) corridor."
          },
          {
            "area": "Modern Digital Experience",
            "observation": "Your practice website is modern, mobile-friendly, and offers convenient online scheduling and patient financing."
          }
        ]
      },
      "top_priorities": [
        {
          "rank": 1,
          "title": "Claim Healthcare-Specific Directory Profiles",
          "priority_level": "High",
          "what_we_found": "Monsoon Dental is verified on Google and Yelp, but key healthcare directories including Healthgrades, Zocdoc, and WebMD Care lack claimed or complete provider profiles.",
          "why_it_matters": "Healthcare search systems and patients cross-reference doctor credentials and accepted dental insurance across specialized medical directories.",
          "recommended_action": "Claim and optimize practice profiles on Healthgrades, Zocdoc, and WebMD Care with complete dentist bio and insurance listings.",
          "relevant_service": "Healthcare Directory Claiming",
          "evidence_ids": [
            "cit-001"
          ],
          "source_finding_ids": [
            "cf-001"
          ]
        },
        {
          "rank": 2,
          "title": "Accelerate Patient Review Acquisition Process",
          "priority_level": "High",